[
  {
    "id": "official-deployment",
    "contentType": "foundation",
    "category": "comfyui",
    "title": {
      "zh": "ComfyUI 从零到第一条 H3 带声视频",
      "en": "ComfyUI zero to your first H3 video with audio"
    },
    "outcome": {
      "zh": "从空白 ComfyUI 环境出发，正确放置 5 个模型文件并生成一条画面、对白或环境声都能播放的 T2VA MP4。",
      "en": "Start with a clean ComfyUI setup, place all five model files correctly, and render a playable T2VA MP4 with picture and synchronized audio."
    },
    "audience": {
      "zh": "第一次在 NVIDIA 电脑上本地运行 MiniMax H3、希望照着步骤完成而不是自己研究节点图的新手。",
      "en": "First-time NVIDIA users who want a guided local MiniMax H3 run instead of reverse-engineering a node graph."
    },
    "hardware": {
      "zh": "Windows 或 Linux + NVIDIA GPU；先准备充足磁盘空间。显存不足时先用模板预览尺寸，不要一开始就跑 1344×768。",
      "en": "Windows or Linux with an NVIDIA GPU and ample disk space. Start at the template preview size when VRAM is limited instead of jumping to 1344×768."
    },
    "prerequisites": {
      "zh": [
        "ComfyUI 0.30 或更新版本，能正常启动",
        "NVIDIA 驱动与 ComfyUI 安装方式匹配；桌面版按官方安装器处理依赖",
        "可访问模型文件，并为下载和输出预留空间"
      ],
      "en": [
        "ComfyUI 0.30 or newer, starting without errors",
        "NVIDIA drivers compatible with your ComfyUI installation; use the official installer for Desktop dependencies",
        "Access to model files and enough disk space for downloads and outputs"
      ]
    },
    "steps": {
      "zh": [
        "安装或更新 ComfyUI：Windows 新手先打开材料区的官方 Desktop 安装指南，按安装器选择 NVIDIA 并完成依赖安装，再用桌面应用启动。Linux/手动安装请先按官方手动指南克隆仓库、创建并激活独立 Python 环境和安装匹配 CUDA 的 PyTorch；只有这条路线才执行下方 pip 与 main.py 命令，工作目录为包含 requirements.txt 的 ComfyUI 仓库。确认页面能打开且没有 CUDA 初始化错误后再继续。",
        "打开 Template Library → Video → MiniMax H3 T2V。若弹出模型下载窗口，直接按提示下载；若手动下载，必须保持原文件名。",
        "把 minimax_h3_fl2va_pruned_int8_convrot.safetensors 放进 ComfyUI/models/diffusion_models/。T2V 与 I2V 都用 FL2VA；只有 R2V 才换成 Ref2VA 权重。",
        "把 qwen3vl_32b_minimax_h3_nvfp4_awq.safetensors 放进 ComfyUI/models/text_encoders/；把 video VAE 和 audio VAE 一起放进 ComfyUI/models/vae/。缺少音频 VAE 时不能把静音结果当作成功。",
        "把 minimax_h3_fl2v_turbo_8step_v1.0_comfyui_bf16.safetensors 放进 ComfyUI/models/loras/。它用于模板的可选 turbo_mode；第一次基线先关闭 Turbo，使用默认 20 步。",
        "重启 ComfyUI 或刷新模型列表。逐个检查 Loader 下拉框能找到 diffusion model、text encoder、两个 VAE 与 LoRA；出现 null、undefined 或红色节点时先修路径，不要直接 Queue。",
        "先用模板预览尺寸、16:9、multiple=32 和短时长生成。Prompt 先写完整场景，再写分镜/运镜，最后写对白、音效和音乐；先不要加自定义节点或多种加速器。",
        "点击 Queue，等待 VAE 解码与视频封装完成。打开输出 MP4，分别检查画面、时长、声音和口型/事件同步，并保存这份工作流作为未修改的 baseline。",
        "基线通过后再把分辨率提高到 H3 原生 1344×768，或在 Resolution Selector 选择 0.98 MP；不要选 1.0 MP，它会得到超过面积上限的 1376×768。",
        "需要首尾帧时，在同一 FL2VA 工作流连接 first_frame/last_frame；需要人物、风格、动作或声音参考时，新建 R2V 模板并换成 Ref2VA 权重，不要在原图里混用两套模型。"
      ],
      "en": [
        "Install or update ComfyUI. Windows beginners should follow the linked official Desktop installer and launch the app after NVIDIA dependencies finish. For Linux/manual installs, first follow the manual guide to clone ComfyUI, activate its isolated Python environment and install the matching CUDA PyTorch build. Only that route uses the pip and main.py commands below, from the ComfyUI folder containing requirements.txt. Confirm the UI opens without CUDA errors before continuing.",
        "Open Template Library → Video → MiniMax H3 T2V. Use the model-download popup when available; preserve the exact filenames for manual downloads.",
        "Place minimax_h3_fl2va_pruned_int8_convrot.safetensors in ComfyUI/models/diffusion_models/. T2V and I2V use FL2VA; only R2V switches to Ref2VA weights.",
        "Place qwen3vl_32b_minimax_h3_nvfp4_awq.safetensors in ComfyUI/models/text_encoders/. Put both the video and audio VAEs in ComfyUI/models/vae/. A silent render is not a successful audio-video setup.",
        "Place minimax_h3_fl2v_turbo_8step_v1.0_comfyui_bf16.safetensors in ComfyUI/models/loras/. It powers the optional turbo_mode; keep Turbo off and use the default 20 steps for the first baseline.",
        "Restart ComfyUI or refresh the model list. Confirm every Loader finds the diffusion model, text encoder, both VAEs, and LoRA. Fix null, undefined, or red nodes before queuing.",
        "Render a short clip at the template preview size, 16:9, and multiple=32. Describe the scene first, then shots and camera, then dialogue, effects, or music. Add no custom nodes or stacked accelerators yet.",
        "Queue the graph and wait through VAE decode and MP4 assembly. Open the file and verify picture, duration, audio, and event or lip synchronization. Save this untouched graph as the baseline.",
        "After the baseline passes, move to the native 1344×768 canvas or 0.98 MP in Resolution Selector. Do not choose 1.0 MP because it produces 1376×768, above the model area cap.",
        "For first/last frames, connect first_frame or last_frame in the same FL2VA graph. For identity, style, motion, camera, or voice references, open the R2V template and switch to Ref2VA weights instead of mixing model families."
      ]
    },
    "commands": [
      "python --version",
      "python -m pip install -r requirements.txt",
      "python main.py",
      "ComfyUI/models/diffusion_models/minimax_h3_fl2va_pruned_int8_convrot.safetensors",
      "ComfyUI/models/text_encoders/qwen3vl_32b_minimax_h3_nvfp4_awq.safetensors",
      "ComfyUI/models/vae/minimax_h3_video_vae_fp16.safetensors",
      "ComfyUI/models/vae/minimax_h3_audio_vae_fp32.safetensors",
      "ComfyUI/models/loras/minimax_h3_fl2v_turbo_8step_v1.0_comfyui_bf16.safetensors"
    ],
    "checks": {
      "zh": [
        "5 个模型文件都能在对应节点中选中，没有红色缺失节点",
        "20 步基线任务能完成，输出 MP4 可以站外播放器正常打开",
        "视频含声音，且对白、环境声或音效与画面事件基本同步",
        "已保存一份未叠加第三方节点的 baseline 工作流 JSON"
      ],
      "en": [
        "All five model files appear in their matching nodes with no red missing nodes",
        "The 20-step baseline finishes and its MP4 opens in an external player",
        "The video contains audio and dialogue, ambience, or effects broadly align with picture events",
        "An unmodified baseline workflow JSON is saved before adding third-party nodes"
      ]
    },
    "caveats": {
      "zh": [
        "模型文件很大；磁盘空间、下载中断和文件放错目录是最常见的首次失败原因。",
        "T2V/I2V 使用 FL2VA，R2V 使用 Ref2VA；权重混用会导致节点找不到模型或结果异常。",
        "H3 分辨率需为 32 的倍数；高分辨率和长时长会显著增加显存与等待时间。",
        "官方模板和文件名会更新；执行前用参考资料复核当前版本，不照抄过期截图。"
      ],
      "en": [
        "Model files are large; storage, interrupted downloads, and wrong folders are the most common first-run failures.",
        "T2V and I2V use FL2VA while R2V uses Ref2VA; mixing weight families causes missing models or bad output.",
        "H3 resolutions must be multiples of 32, and higher resolution or duration sharply increases VRAM and wait time.",
        "Templates and filenames evolve; verify the current reference before following an old screenshot."
      ]
    },
    "posterUrl": "/tutorial-posters/foundation-official.svg",
    "tags": [
      "ComfyUI",
      "T2VA",
      "Beginner"
    ],
    "relatedResourceIds": [
      "official-minimax-h3",
      "minimax-h3-easy",
      "huangserva-director-workflows",
      "comfyui-wiki"
    ],
    "source": {
      "platform": "docs",
      "url": "https://docs.comfy.org/tutorials/video/minimax/minimax-h3",
      "author": "ComfyUI",
      "authorProfileUrl": "https://github.com/Comfy-Org",
      "originalLanguage": "en"
    },
    "verifiedAt": "2026-09-06",
    "addedAt": "2026-08-23T02:34:28+08:00",
    "flagship": true,
    "difficulty": "beginner",
    "hardwareProfiles": [
      "vram-16",
      "vram-24-plus",
      "cloud-gpu"
    ],
    "expectedResult": {
      "zh": "生成一条可在普通播放器打开、包含同步声音的短 MP4，并保存一份未叠加第三方节点的 baseline 工作流。",
      "en": "Render a short MP4 with synchronized audio that opens in a regular player, and save an untouched baseline workflow before adding third-party nodes."
    },
    "troubleshooting": [
      {
        "problem": {
          "zh": "Loader 中找不到模型",
          "en": "A model is missing from a Loader"
        },
        "solution": {
          "zh": "核对五个文件的原始文件名与目录，刷新模型列表并彻底重启 ComfyUI。",
          "en": "Check the original filename and folder for all five files, refresh the model list, and fully restart ComfyUI."
        }
      },
      {
        "problem": {
          "zh": "输出静音或音画不同步",
          "en": "The output is silent or out of sync"
        },
        "solution": {
          "zh": "确认 audio VAE 已加载，并先在不含第三方节点的 20 步短片上复现。",
          "en": "Confirm the audio VAE is loaded and reproduce a short 20-step render without third-party nodes."
        }
      }
    ],
    "uninstall": {
      "zh": [
        "删除本教程新增的模型文件前先确认没有其他工作流引用。",
        "保留 baseline JSON，出现兼容问题时退回官方模板。"
      ],
      "en": [
        "Before deleting downloaded model files, confirm no other workflow references them.",
        "Keep the baseline JSON and return to the official template when compatibility breaks."
      ]
    },
    "sourceRefs": [
      {
        "title": "MiniMax H3 official repository",
        "url": "https://github.com/MiniMax-AI/MiniMax-H3"
      }
    ],
    "learningTrack": "run",
    "depth": "deep",
    "evidence": {
      "status": "active",
      "sourceCheckedAt": "2026-09-06",
      "basis": "official"
    },
    "applicableVersions": [
      "ComfyUI 0.30+ · native H3 T2V template"
    ],
    "materialsNote": {
      "zh": "链接提供原作者工作流、模型或示例；自选参考素材需自行准备。本站没有另行实测这套生成流程。",
      "en": "Links lead to the original workflows, models or examples. Supply your own reference assets where needed. This generation workflow has not been independently run by this site."
    },
    "recommendation": {
      "zh": "使用官方原生模板，先建立一条带画面和声音的基线；不要求新手先学第三方节点。",
      "en": "The native template gives a picture-and-audio baseline before introducing third-party nodes."
    },
    "learningResources": [
      {
        "label": {
          "zh": "官方 T2V 工作流 JSON",
          "en": "Official T2V workflow JSON"
        },